date,character,asset_type,issue,cause,mitigation,reusable_rule,related_path
2026-05-25,project,runtime,python command resolves to Windows Store shim,The system python.exe path reports version 0.0.0.0 and does not run normally,Use bundled runtime from Codex workspace dependencies,Prefer the bundled Python executable when running tools in this workspace,tools/build_project_html.py
2026-05-25,project,transparent_assets,complex hair and lace may leave chroma residue,Long dark hair lace and fine accessories have many antialiased edges,Generate with generous padding and flat #ff00ff background then validate alpha corners,Do not accept transparent assets before visual edge inspection,tools/remove_chroma_batch.py
2026-05-25,project,web,generated images should not contain final Chinese text,Image models can distort dense text and labels,Let HTML render all labels captions borders and long text,Keep image prompts textless unless a small visual mark is explicitly needed,assets/styles/luo_sisters.css
2026-05-25,project,parallel_work,assets can be saved into the wrong sister folder when agents work in parallel,The two characters share similar asset types and filenames,Validate every item path starts with assets/characters/<character>/,Run validate_assets.py before handoff,tools/validate_assets.py
2026-05-25,project,responsive_css,asset grids showed small horizontal overflow,Default figure margins added extra width inside CSS grid,Reset figure margin to zero in shared CSS,Always reset native figure margins before using figure as grid tile,assets/styles/luo_sisters.css
2026-05-25,project,browser_qa,lazy images looked broken in automated mobile checks,Offscreen loading=lazy images had naturalWidth 0 before scroll reached them,Remove lazy loading from generated local showcase pages for this phase,Prefer eager loading while pages are used as visual QA boards,tools/build_project_html.py
